{
  "version": "AXEL1",
  "id": "20260212T1430Z",
  "scope": {
    "hostnames": ["explicit.example.com", "cdn-explicit.example.com"]
  },
  "content": {
    "category": "adult",
    "min_age": 18
  },
  "enforcement": {
    "profiles": ["AXEL-O", "AXEL-N"],
    "proof_required": true,
    "browser_flow": {
      "gate_url": "https://explicit.example.com/verify"
    },
    "api_flow": {
      "problem_type": "https://axel-protocol.org/problems/proof-required"
    }
  },
  "isolation": {
    "level": "L1-AUDITED",
    "prefixes": {
      "ipv6": ["2001:db8:abcd::/48"],
      "ipv4": ["198.51.100.0/24"]
    },
    "cdn_pool": "explicit-only-pool-us-east"
  },
  "verifiers": [
    {
      "name": "ExampleVerify",
      "url": "https://verify.example.com",
      "methods": ["zkp", "gov_id"]
    }
  ],
  "auditing": {
    "statement_url": "https://auditor.example.org/statements/example-com-2026.json",
    "policy_hash_sha256": "e3b0c44298fc1c149afbf4c8996fb92427ae41e4649b934ca495991b7852b855"
  },
  "cache": {
    "max_age_seconds": 86400,
    "stale_if_error_seconds": 604800
  },
  "extensions": {}
}
